{
  "created_at": "2026-07-23T16:26:57.281997Z",
  "goal": "Finish and independently verify rebuild-tde-physics-core with truthful evidence, corrected orchestration, and a reusable autonomous completion prompt.",
  "job_ids": [
    "J001",
    "J002",
    "J003",
    "J004"
  ],
  "protocol_version": 4,
  "revision": 3,
  "run_id": "RUN-tde-completion-20260723",
  "schema_version": 4,
  "status": "completed",
  "updated_at": "2026-07-24T08:59:48.506274Z"
}
